Author Name,Score,Commment Body
Papilionanthe,1,"BGS is generally pretty chill.

Managing mods are kinda fluff tbh. You can also clear Managing mods while on student exchange."
Koufas,1,"It is much, much better to take modules you will benefit more from rather than focus on trying to maintain a good GPA by taking modules that do not value-add much to your future career.

What is the point of a high GPA if you cannot answer technical questions in an interview? Go with what you think would be more valuable and important for your future career. Or what you are passionate about

Uni is too short to spend time taking modules you don't really care about (unless you don't have a choice)"
Darkreaper007,3,"Hey! 
You’ll have to make an appointment and collect it from ICA, and the appointments can be booked starting from one month before the course start date, which will be from 15th July for us."
kekekekekekkek,2,"Mktg, MPW and bgs is very content heavy. MA and OM need to practice a lot. Personally I would drop one and switch to a fluff mod or just take 4 mods instead. But that's just me cause I know I won't be able to manage"
Snorelax595,1,"Don need drop, GL"
MysticAuraa,2,"Your choices with those specifications will serve you well regardless of whatever you want to run (as long as its not games). It's really ultimately up to your own preference as for which one to get. However for durability, I think Acer Swift 5 may not last that long (friend's one died for no reason after 2 years)."
Stunning_Command_949,1,"Adding on to this, once we do buy a laptop I saw something about getting getting some software installed? What exactly are they and how should we get that done?"
itslolobitch,3,"you can still matriculate on adhoc basis during 6-8 July, intl student here, same situation as you so i emailed em and that's what they said 

pm and i can share the ss"
trashmoney4,1,hold on I'm in the same boat here - we can pay the confirmation fees already? i thought we can't do anything until the IPA is issued?
VurhD-2312,1,After the form e16 has been submitted you should get an acceptance email from SMU in one to two weeks regarding the acceptance of your student pass application. After this you can log into SOLAR ICA website to upload the medical examinations reports and the signed terms and conditions document. After this you will be able to book an appointment to collect the student pass in Singapore
natatatatatata,1,Microsoft tech support
Soon-to-be-forgotten,1,"You may wanna ask on /r/Office365.

On your question regarding losing your subscription after graduation, it depends on whether SMU would remove you as a user after you have graduated. My polytechnic still hasn't removed us from their subscription, in spite of us graduating years ago, which is nice."
Key_Channel_7311,1,i just received my results for appeal via email!
sknsingapore,1,i am an international student too and mine is still processing. they said it should come out this month.
AmazingStart6323,1,Me! But I received an email explaining that mine will be out by 15th July. Also an international student
Sad_Improvement_8663,1,I also the same position ...not yet
endeavourzzz,2,"Don’t be upset at it, think about it at the end of the day you have a degree on hand which will minimally give you a upper $3k salary which is more than what your peers with diploma get as a starting plus you can build up your portfolio at work. Yes you might have missed internship and might not get a higher starting salary as your peers with Summa Cum Laude or those with internship portfolio at big firms but you can build your way up. I have known people who start off their career on a high only to hit lows when the work life balance lacks and some leave for their personal interests. 
Making it here is aldy a feat so don’t be negative and look on the bright side of things"
lostinliife,3,"1) Freshmans have their own protected bidding on 29th July which is good, cause I’m broke as heck trying to get my mods this sem; why is there so much inflation yall grr.

2) Someone has mentioned it.

3) 4-5 really depends on how much you can handle, most recommend 4 when you’re taking the basket with DA, FA and BizLaw, but it’s your preference. 

4) Pretty much, you can just tick off your biz and uni cores first at the start. 

5) Ultimately your choice, not a big deal if you don’t join but it’s a way to make friends"
Any-Background-7568,1,"Global exposure has multiple options  u can fulfil by going overseas (I think u bear the full cost) OR category C which u just need to complete the mod on e-learn.

The number of mods to take per sem per annum is subjective. For e.g When I first joined, I was given 3 Free-elective CUs for free literary.  Hence instead of having to need 36CUs to grad (for IS) I only need 33 CUs then I just plan the min no of mods I have to take to grad on time.

It is said to be easier to score when ure  junior.

Yes if u go to the page about ur degree info it is layer out for u alr like e.g the tracks.

Orientations don't matter if u know how to navigate ur resources but I think u shud becoz u can ask the seniors questions.

For the basket I'm not sure because I was preassigned 5 mods in year 1 sem 1. For sem2 I was preassigned 3 mods, then I can bid for any courses I want that fulfils my grad requirement (go to ur degree page the one where it shows ur track)

Also, internships and community services are 1CU each which are included in the 36CUs.

Any further questions about ur degree course graduation requirements u should email ur respective school.  The email should be in the Course Guide pdf, read it.

There's also live chat on smu admission website.

Welcome to smu :)"
synrg18,1,"1. As was answered already. You’ll have protected class slots so you can bid mods safely

2. Completely depends on what you do for it. Usually at least a week I think, if you go overseas. Can be CSP, short term exchange, study mission or full exchange programme. I think there’s now elearn mods and overseas mods that clear global exposure too.

3. Also depends on what you prefer. Do you wanna chiong now or later? I at least wouldn’t recommend doing it right away, just so you can get used to uni life and commitments first.

4. You can do it in any order, but you have to finish all the requirements listed in your handbook.

5. Yes. You’ll figure your way around eventually and you’ll have other chances to meet people. Personally I didn’t gain that much from orientation."
AmbassadorLoud2073,3,"I'm an incoming freshie who also saw a bunch of CCAs and is in a dilemma on which to join too LMAO especially since I watched a youtube video that stated that its best to join only 1-2 CCAs while I literally have 3-4 that I'm kinda interested in. In my opinion, the CCA should be something that interests you, plus you would meet like-minded friends with similar interests too! Though I THINK it would be good if one of your CCAs is under one of the community service clubs etc. that would gain you some CSP hours??"
kekekekekekkek,1,"Yes those clubs still exist lmao in fact SMUBE is the largest CCA in smu if I'm not wrong because it has many wings. Vivace is coming up soon, it is a CCA fair where u can go to each booth and find out more about it. This year will be the first physical vivace in 2 years so that'll be a great opportunity to interact."
MysticAuraa,4,"loan will probably take 1 to 2 months. Bursary will take anywhere from 3 months to forever, they rly damn slow with bursaries zz."
js_awesome,2,"Hi im also incoming freshie

- actually have you thought that (actually) it would be much easier to maintain high GPA if you didnt take a second major

-probably warning if u no get 3.4. Then eventually, scholarship withdrawal. Tuition grant still remains but u pay back the scholarship money"
yoyoyobren,1,Hey do you mind sharing your result ?
Upset_Safety_9867,8,I think its 29th! I just tried to access the bidding page but they prompted that I am not authorized to access the page haha
js_awesome,2,I submitted on tuesday afternoon and approved by friday afternoon
shitama,1,you’ll only be able to make your appointment a month before the course start date (so i assume mid july-ish). i’ve submitted the payment + medical document around 2-3 weeks ago and im still not able to make one
AmazingStart6323,1,I also received that email. I thought it just means they are processing our application??
Sad_Improvement_8663,1,Same position
trashmoney4,5,still waiting for my visa so I can matriculate and sign up 😭😭
AmbassadorLoud2073,5,run 2 haddock
AdRich6141,3,Hi I'm in run 1 croft!
BillionDollarDirt,3,run 1 porter
Separate_Ad_3321,2,run 3 croft
shitama,2,run 3 jones!
WalkAlive9557,2,Run 1!
Rihah_Adriana,2,Run 1 Jones HAHA :)
Memememeyouyou,2,run 1 jones!
Tight_Stop_3522,1,following:)
Koufas,3,"Other than the one at SCIS I don't think there is

Very unlikely your bike will be stolen given that its Singapore."
Ok-Traffic-573,2,"There's one at Connexion, near the stalls"
Darkreaper007,1,Following
Koufas,1,Research Methods are a pain but quite fundamental imo
VaeVictius,5,"Freshmen Orientation: students from all faculties in the school

School Orientation: students only within your own faculty"
Koufas,1,"If you only want to attend one would recommend attending your school faculty's orientation as, unlike FO, you will be spending much more time seeing people from your faculty around"
kikapokka,4,"helloo, fellow soss pps student here.

1. first of all, students are given e$100 to bid every sem. for y1 soss students, there’ll be 3-4 mods pre-assigned. 

usually an avg of 4-5 mods are bidded per sem. 
if u choose to have a 5th mod, u can bid for one. in the case where you’re preassgn 4 mods, you’ll have e$20 remaining. similarly, if you’re preassgn 3 mods, you’ll have e$40 left. (u get the math) 

it’s entirely up to you if u wna hve a 5th mod, but hving 4 mods per sem is the usual.

freshmen bidding starts on 29th July, you shld be able to see ur preassgn mods on BOSS during that week by then. 


2. (honestly can’t rmb which is which but for soss):
Basket A: Intro to Psych, Understanding Societies, SEA
Basket B: WR, Econs & Society, Big Questions, Intro to Politics and Policy Studies 

whichever basket you’ll be in first is random.
you’ll only know once ur preassgn mods are out on BOSS. 

take note: if you’re in Basket A in sem 1, you’ll take Basket B in sem 2. (vice versa)


3. (i was exempted frm calculus, so i can’t ans this!) but heard that the mod is mainly abt differentiation and integration. 


4. unless you’re exempted frm calculus, the ans is no. you wld need to take both calculus AND intro to stats.

for us soss, we usually take intro to stats.
stats theory is usually for those in soe.
but it’s entirely uty on which stats mod u wna take.

hope i managed to answer ur qns! jiayous for bidding and atb for your first sem in smu :)"
idevilledeggs,3,"1) You'll have to bid yourself. You can check the [academic calender](https://inet.smu.edu.sg/sites/courses/Documents/Current%20or%20Future%20Academic%20Calendar/2022-2023/2022-23.pdf) to check when the bidding will occur. Freshmen do not share bidding with the rest of the school.
2) The school will sent an email regarding what basket you'll be in. These mods will be preassigned and you do not have to bid for them. Depending on the number, you won't even have to bid for additional mods if you don't want to. Most seniors recommend you take 4 mods in y1s1.
3) As someone who got D in maths in JC, it's not too bad? I didn't do calculus specifically; I did Stat theory which is harder the Stats. But it was overall quite ok.
4) For PPS? No, you have to take calculus to fulfil your numeracy basket unless exempted. In which case, you can take stats. Like I mentioned earlier, intro to stat theory is harder but the bids are cheaper. In this regard, you might want to avoid it. You can check the [school handbook](https://inet.smu.edu.sg/sites/courses/Documents/Student%20Academic%20Handbook/BSocSc/BSocSc%20Handbook_2019-20.pdf) for more details."
trashmoney4,2,"hello fellow PPS freshman!!! I'm worried about calculus too omg 💀💀 the last math I did was IGCSE maths so uhmmm 😀😀 panic panic but I did make a post abt it earlier and someone answered saying that the profs teach pre calculus first and as long as you know basic math like algebra n angles you'll be okay. I'm still not convinced so I'm trying to brush up as much as possible 💀💀 

hope to see you around on campus in august!!"
MysticAuraa,2,"yes, you'll be receiving emails about it closer to the briefing date"
Minimum-Guest-5281,1,you can see your academic briefing dates via the smu matriculation website under ‘Attend Key Activites’
MysticAuraa,2,"There may be different steps for you to take during some software installations but there isn't much difference compared to windows. Some modules like Data Mining Applications may need you to bootcamp to Windows iirc. Just get the Macbook Air if you feel like getting it, many people in IS also use Macbooks without issues."
itslolobitch,1,following
js_awesome,1,"I am also incoming


1. From my understanding, we will live in an apartment unit. So like a house with kitchen and sharied toilet. But this kitchen wont be fully fledged. And there we can keep our own food etc and arrange with each other. 

The common kitchen prob we go there with ingredients, cook and cleanup. Bring all stuff back

2. Also only 2 floors in psr with no lift"
theskyveryblue,1,"there are 3 blocks. each block is split into 2 separate sections. each section of each floor is one apt. btw psr has 4 floors not 2. so each apartment (10rooms) wld share one common area (incl the kitchen). imagine it as a 10bedroom house basically. most apartments dont share groceries if im not wrong. theres no stove as well, so its up to ur apt whether u guys wld want to split n share cost to buy an induction cooker. theres 2 fridges provided for each apt, so u can store wtv stuff u buy in there. if u guys choose not to buy an induction cooker, each apt still comes with a microwave for quick heating up of ur food. anw psr is extremely conveniently located so theres many food options ard if u choose not to cook. 

would say the best thing abt psr is rly that its prob cheaper than renting an apartment. n u hv the opportunity to make friends. of course, the apt may not be the cleanest at times, esp nearing the end of the sem when everyones too busy to clean up."
MysticAuraa,5,why does the logo look like some CNY logo lmao
RaspberrySea7226,1,Can going-y2 join also? I matriculated late last year and didn’t have the opportunity to go to any camps😩
VaeVictius,1,"Hi! Not really related to META 22, but is it possible that the groupings we are allocated to during orientation be related to the allocations of our pre-assigned mods when we start classes (aka you get into the same class as the people in your orientation groups). 

My concern mainly being, let's say, I made a lot of friends during orientation, only then to not get into any similar modules as them due to a lot of mods being pre-assigned in Y1 and then I would have to start making friends all over again anyway.."
thebingeycode,1,sign ups close alrdy 😭 what's the likelihood of attending if we're in the wailist?
thinkingofmarius,2,"that’s alright! i think it’s common for international schools. i came from an international school, through the gce a-levels route and i only got my acceptance on the 1st of august, which is super late compared to everyone else"
trashmoney4,1,me :(( i submitted my application in December and I haven't heard anything since my interview which was in April 😭
_seren1ty8,1,I graduated May 28th under an American Highschool Diploma and mine still showing processing too :’)
MysticAuraa,3,you need to sign in with the google account with your schools email address to access these links
Soon-to-be-forgotten,1,"On your third question: You can still definitely try to appeal, even after you have started your course. But again there's no guarantee, since by then they would be looking at your university GPA."
js_awesome,1,Mee
Ill_Course_6379,3,"i think what u have so far sounds good - finance and ops require some time to practice, as for ethics (content-wise), you might have to memorise for the final exams so quite some content there however, the classes can be chill in general if you bid for chill profs, same goes for mpw as well

chill prof reco: michael (really cheap too), don't trust the reviews fully on afterclass - he ends really early on some days bc he doesn't have much content to go through"
Koufas,1,"For freshman orientation it should be free, right? It should be fine

For other camps they are planned, executed and administrated by students who are doing it during their own free time (some of which are doing on top of internships and work) so confirmation might not be immediate within the next working day"
WalkAlive9557,1,"Hi, i havent received any confirmation too"
AmbassadorLoud2073,1,For the ACF camp I Rcvd the payment request on outlook (use your SMU email to access it) but nothing since than.
AdRich6141,3,"Hello, it will be a mixture of online and in-person activities"
Koufas,1,You could email them; they usually reply pretty quickly
yashmitkedia07,1,"It's not an issue, what you can do is pay your fees by credit card or wire transfer or some other way before you go. After that when you reach campus go to the student services hub and tell them you're an international student who wants to open a bank account and so ask for a letter which would prove you live in the place you do. After that you'll need passport ICA (I think that's it) and then you go to any bank branch you want to open and open a student account and put that account details as receiving. I did my bank account in like mid Jan or something."
Koufas,1,"Youd have to bid

Which DDP you doing?"
MysticAuraa,4,"1. Yes, you will need to bid for mods every sem in SMU. If you are preassigned 4 or 5 mods in your first semester, you don't have to bid for additional mods. Anything less, I recommend bidding till you have at least 4 mods.


2. Academic briefing email will likely come mid to late July


3. There's an event called Vivace which is like a CCA fair during which all the CCAs will host chat rooms and sessions for you to explore. During this period, CCAs will be opening up recruitments and send out EDMs. Signing up is really easy, most of the time just filling up a google form with a CCA trial after if you are joining competitive CCAs.


4. You can ask your facilitators any other questions during orientation. There's quite abit needed to know about bidding but I'm sure they will be a post explaining it in further detail for freshman nearing the bidding date."
AdRich6141,1,"hi im matriculating into SoSS too, sorry that my comment is irrelevant to your post but which course are u in? (I'm in PPS and it would be nice to find fellow coursemates before sch starts)"
Koufas,1,"Drop me a DM and I will connect you with someone from the CCA who went through something similar to this. She is also completely new to dance, has 1000 commitments but is totally acing her school life. A really driven and inspiring person - would really recommend connecting with her"
jewjewbae,1,"Hi!! You can msg me on reddit, i just ended my WSE :)"
Koufas,2,"In general (oversimplifying) there are

Mods that are generally calculation heavy ie give you numbers, you memorise formulas, then you solve. Graphs are usually included. These usually apply to Micro mods

Then you will also find mods whereby your manipulation needs to be good and have strong fundamentals. Instead of working with numbers and calculations all the time its more of using math as logic to solve problems

For example you learn 4 equations with say 10 variables in total and some of these equations interact with one another. If you change x to (x-a) how does it change the system of equations compared to before?

Macro mods are usually like this - as well as some of the intermediate mods that you can come across.

Then finally you have the more quantitative side of econs, or metrics. How do you use stats in a way to solve economic problems? This is usually what people refer to as the basics of technical economic analysis. Its heavy in statistical methods

Most econs mods are generally some combination of the three, although there are also mods that are more qualitative in nature. But even then, they might be taught as qualitative but they rely on previously established quantitative studies 

EDA is a good first mod to get acquainted with as it teaches you how to read econs/stats research papers so i would suggest taking it first if you are new to econs as a discipline. Metrics is rough but its good to take it early too so in your future mods when you are doing your own reading/extra readings its a lot easier to understand them

Would also suggest taking EDA + Metrics before taking a Political Economy mod as it is more of an econs/stats mod at its core"
Pundehlord,3,"Isn't B the average grade? No harm appealing (other than the fee to pay), if you feel like you could get a higher grade."
Papilionanthe,2,How do you know the component grades for the rest of the class?
giant_hippocampus,1,"Can anyone clarify the differences between the 3 of them for me, please?? 🥲"
its_meonly,1,me!!
Neilscallywag,1,Me
Aiyaking,1,Sup!
ScienceIll1395,2,my interview was on 12April and received acceptance email on 19may
shinysqueegee,2,"My interview was in late Apr and received offer on June 2, but the late offer might have been cuz I'm an international student who applied with intl qualifications. (Almost all of the intl applicants I've met didn't hear anything till the 2nd window)"
shiningmidsummer,1,"hi fellow incoming socsc freshie here and paid matric fee on very first day haha, i recieved the email to sign up for freshmen ori yesterday evening!"
colourfulcarrots,1,"hi! im enrolling in socsc too, got my ori camp signup email yesterday, and did all the online matriculation stuff on 3 june! :))"
Sensugan,-2,Do the 2024 matriculation students called for orientation too? Pls clarify. No invitation for us
