Author Name,Score,Commment Body
Old_Emu811,3,"As an alumni, I can assure you there will be many opportunities to make friends, from project groups or OCSP (because we die die need clear hours), or exchange. Long story short, there are many opportunities to do so. 

Be yourself and you will do just fine. The friends will come naturally. All the best!!"
Desperate_Cucumber82,1,samee ~ feel free to pm me ‘ Im also a y1 now
Koufas,3,Usually its 30-35% for an A-band for non SMU-X modules
kekekekekekkek,3,I think u can only tap in after the library is closed. During opening hours need use official entrance
thebingeycode,2,try to reset at campus security behind SMU shop?
Burbursur,6,"Year 4 here. After 4 years I am still not used to class parting. I get anxious everytime I wanna cp and repeat what I wanna say again and again and again in my head before actually saying it. Sometimes by the time I decide to raise my hand, someone would have already said what I wanted to say so I dont cp a whole lot too.

Having that said, I wouldnt worry too much (grades wise). Some modules count class part through the elearn discussion forum as well and its possible to attain full cp marks without even opening your mouth hahaha. You can still attain stellar grades without speaking in class (depending on the mod).

So overall, over the course of your uni life, I would say that not verbally speaking in class does affect your grades but its not nearly significant enough to justify you worrying about it.

Dont worry too much and atb in your Uni life!!!"
WalkAlive9557,3,Same issue here. I guess it really depends on the percentage of class participation mark
AmbassadorLoud2073,3,"Similar issue here, especially in my bidded classes where seniors class part at every chance they get. For some of my modules my profs gave us a class part rubric to follow, and as long as we do assignments or attempt to contribute to team discussion(during group work), it counts as class part. Heck, i even have a module where my prof asks every single person a question, to help us gain cp marks. 

But for some classes, not a very good method, but I usually wait a few seconds to see if anyone answers the profs qns, and if no one answers I’ll try to give my points. This method isn’t the best as you can tell, in classes where there are cp snipers I’ll defo lose out. Otherwise when the prof allows us to pose questions/opinions on the telegram chat/padlet/slack etc, I’ll take full advantage of those XD"
Prestigious_Nail_279,2,"I’m a freshie too, and I’d say if you have something outside of the scope to mention or an opinion you’d like to share I’d say just step out of your comfort zone and share it

I recently presented my thoughts in class for a question posed and was low key embarrassed because I got the essence of the question wrong, but when I looked around and observed I think no one really cares, everyone’s there trying to learn and grow together! 

Likewise for yourself, I think sharing your unfiltered thoughts (albeit be a tad wary.. cause “unfiltered”) with the class can sometimes proof to value add in discussions, or what the prof is sharing."
grampa55,-3,Seems like NTU/NUS is a better fit
Soon-to-be-forgotten,1,"Assuming your friends are SMU students?

Frankly, no you shouldn't, especially not under peer pressure.

In all honesty, most people won't stay with the same clique (or even stay friends) throughout their four years in SMU. Depending on whether you bid with them in subsequent semesters and the size of your cohort, you may NEVER see them again.

Ultimately, you need to make the decision yourself. 

Also note that vape is illegal in Singapore so don't get caught if you really smoke it. You don't wanna get in trouble when you're still young and in school."
endeavourzzz,1,"No, why would you do that to fit in? They are probably using it as a coping mechanism or to substitute smoking if they were smokers. If you don’t have such habit why pick it up. 

You can instead learn from the good things like picking up new food to try or new hobbies to go for which all doesn’t harm your health."
Gohbraztsovashka,18,You’re gonna be doing so much fucking group work and chances are you’ll meet at least 1 person you like
AmbassadorLoud2073,4,"Here's my take (I'm a y1 student)

Hi bye friends: ez game. Made by attending camps or chatting with the people around you in class

Friends that will stick with you until you graduate, can actually rely on and hang out outside of sch: still finding, hopefully at least one of the many ppl I've talked to so far wl fit into this category :')"
Koufas,3,"Nope

Just say hi to the people sitting next to you in class, introduce yourself, and go from there

Ive made some friends from this sub too tbh. Turns out a few of them joined my extra curricular activities as well :) I think people generally do want to, at the very least, interact. Its just the beginning thats hard"
Bbyys,1,Join any cca and u shld be fine
CaliphTheDips,1,"Rather than thinking by star ratings aka difficulty of making friends, at any point of your life, aim towards thinking of how making connections can benefit you. How about that, and I'm sure they will come naturally as you make the effort :) find common grounds, join ccas, society clubs... study buddies... at the end of the day it's about effort as you put yourself out there. 

PM me also can HAHA (Y1 student here)"
yonghongtn,4,"1. No
2. Yes, but you have to overload or take summer courses"
Soon-to-be-forgotten,2,Use the Curriculum Worksheet in OASIS to plan your courses.
Koufas,9,Attendance and class part
Soon-to-be-forgotten,6,"Not sure which school you're in but SCIS' instructors can be really important.

They are the ones usually responsible for the projects and are involved in answering students' questions about the projects. When they are helping out in 30/40% of your grades, they are IMPORTANT."
kekekekekekkek,4,"Smu fin aid is on a disbursement basis so they will trf directly to yr receiving account, not sure when tho"
Soon-to-be-forgotten,2,"I'm not sure how the money will be returned to you, assuming that you paid more than you should in the period of schooling and you're a citizen.

Usually, the loaned amount would be automatically deducted from the fees but it may take some time to reflect that."
Koufas,3,"Am not exactly an Econs student but I take quite a number of Econs modules

I think that it is very easy to forget that ultimately, Econs is a technical degree, and Econometrics is the basis of technical analysis in econs. There is no escaping from the basic math-related modules. That being said, I think that Math for Econs is the onlybasic one that is super ""math""-heavy, while Statistical Theory and Econometrics are more stats-related which is slightly different from pure Math.

I think in more advanced Econs mods, you will not strictly speaking need to know everything in Math for Econs to an A-standard, but if you do more advanced technical analysis like, say, Forecasting or Time Series you might need to understand certain math concepts (eg Matrix) to understand more advanced techniques well (eg Structural VARs)

Most of the ""math"" is less of math and more of algebra/statistics. In practice, there are many pieces of software that can help us do the math and we don't need to calculate everything by hand (like R, Stata, EViews, SPSS, even Excel...) but we need to know the math/stats behind it before we can apply these things effectively. So youll be using more stats than math strictly speaking

Most modules however are non-technical in nature, but they do require math. However, I will say that most of this math in non-technical mods are more for expressing logic and how things work in a quantifiable way. For example, it is easy to say that growth includes productivity. But how do we express this in a way that is consistent, measurable, and workable? An equation is probably a convenient way to do so

Econs in SMU is not ALL math - tbh compared to my friends in NUS and NTU there is more of a focus of learning how to apply the math through projects (eg reading Bernanke's biography and presenting on how equations can apply or be changed according to his description of the GFC) rather than strictly speaking math alone

I would say that Im not naturally inclined towards math either but im making an effort to do better and be better at it. We can chat in PM if you want, but just because youre not naturally good at math doesnt mean you cant do Econs"
btkh95,1,"Please elaborate why Economics piqued your interest and what are the modules that you currently enjoy?

I would say you really do need some math and statistics as well. SMU SOE also tend to be more exam based than other schools and you kind of need to memorise formulas and stuff.

Just grad this year too. Can drop a DM if you like too."
Koufas,0,"There is no bellcurve in SMU

If you look at the typical grade statiatics for each mod however you will notice that the number of As always hover around the 30-35% mark with the exception of SMU-X Modules"
Koufas,2,"Yes Major Cores cannot be pass/fail

People clear both uni core and electives overseas, depends which is easier for them

People also go with friends or alone depending on their preference. Not set way to go about doing it, just do what you prefer"
existencezxc,2,"I cleared asian studies (ironic as i did my exchange in europe), globalisation and accounting electives (cos i didn't want to do them and fret over them in SMU. Hahaha. Rather get a pass/fail for those) 

It's harder to clear major core overseas because SMU probably wants you to do them here. I don't remember anyone from Accounting clearing their core mods on exchange. 

I went for exchange with a close friend (i.e., someone who I have travelled with before and would stay at each other's houses on a whim), so exchange just felt like an extended trip. 

The thing about travelling with friends is that there are bound to be conflicts and i've heard far too many horror stories about those who fall out after exchange. If you'd like to go on exchange with a friend, choose one wisely! Make sure you can comfortably live/interact with this person for a couple of months. 

If you are the kind who can mix well with others and don't mind making friends, then it's great to travel alone too as it'll be more flexible that way."
addedrepertoire,3,koufu?
Kindly-Ad1072,1,Curious as well zzzz
Soon-to-be-forgotten,1,"There's Mixed Greens (salad store) at Connexion.

It's not wholly vegetarian but you can pick and choose the ingredients you want."
endeavourzzz,1,"Subway is a good option or you can try waffles if not just cross to Lazada, there are a few vegetarian options"
chillingbeer,2,iirc u r exempted 11 out of 15 modules of icaew upon the completion of ur degree. u can join SMU FACT (cca) as they are affiliated to ICAEW
Rapadooz,1,"1. You’ll get 12 exemptions from SMU as long as you do the correct modules and electives. Exam fees for the remaining three are not subsidised and you’ll have to pay full price. Membership fees for ICAEW are waived for four years as long as you have a valid school email address. The price for each exam is about £103 pounds the last I checked. 

2. As mentioned above, membership fees are waived if you’re a current SMU student. For prospective students, you can try to show them ur offer letter and maybe they’ll waive your membership fees. Not so sure about that. 

3. It would be kind of a waste if you start studying for ICAEW certificate or professional papers because eventually you’ll be studying them in SMU and taking their papers. So it’s kind of a double work. 

4. There’s a Business developer manager from ICAEW named Jiaqing Wu. She usually oversees student registration. You can ask her your queries by sending her an email at jiaqing.Wu@icaew.com"
chickenwingandbbq,3,"Hi, im currently living in prinsep large single room.
As for the price, so to secure the room i had to make a payment of sgd1490 for deposit. And recently i was billed sgd3.7k for my current stay from 1st Aug until 31st Dec. (I signed up for full academic year by the way)
Im not sure if the deposit will be deducted or already been deducted (i think its already deducted tho) so that gives you a rough estimate of how much it costs to live here. The charges comprises of monthly furnishing and utility charges."
chickenwingandbbq,1,"And additional costs would include laundry costs, $2 to wash, $1 to dry. Some people hang their clothes out to dry. In each apartment theres 10 single rooms, 10 people and we share 4 showers, 4 toilets altogether. Theres 1st to 4th floors, no lifts so yea it would be physically tiring to live on the 4th floor I guess. Theres no water coolant or dispenser, within each apartment, so most of us just drink tap water. 2 fridges per apartment unit, with a pretty functional kitchen."
Good-Ad-9136,2,Which did you sign up for?
chillichickennoodles,2,"Yeah omg, I signed up for rotaract but I’ve got nothing yet"
iridescent-stars,2,"you could try but i highly doubt so though :(

i’ve met friends who hit all the requirements but still didn’t get exempted for some reason (and myself, who hit all the requirements except my poly’s courses weren’t even listed for the modules that i took lol)"
Koufas,2,"The MOE tuition grant is not given by SMU - it is given by MOE. So its not really up to the school

Don't know of anyone who did more than 8 semesters tbh, most overloaded or did a Summer sem

Could always just e-mail in to Finance to ask"
Soon-to-be-forgotten,1,"If I'm not wrong, your second major would not be reflected on your degree certification, only your transcript."
Soon-to-be-forgotten,3,"Other than the ones mentioned by the other commenter, (I think) there's a corridor with GSRs besides the SOL's gate to the KGC Library. 

It's kinda hidden if you don't really notice it."
kekekekekekkek,2,"Go up the escalator to lvl 2 then make a 'u turn' or hard right, its along the length of the lvl 1 rooms just right above"
tottenhamhotpot,2,"Same here, have you tried emailing them?"
Bbyys,2,"Same lmao, and the fee due in a few days"
BillionDollarDirt,2,"I submitted only in early Aug, I emailed them this week and they said the offer email should come in the next few weeks, and that I should just pay the remaining balance not covered by the loan as it will be automatically offset. Not sure if this applies to you but maybe try emailing them again to ask about this?"
Character_Type_1423,4,I did the opposite and transferred from SMU to other universities!
arissaxli,3,"l believe more information is needed here, like your major and GPA! Good luck!!"
DryPsychology4727,3,"rip, if thats the case im gonna need more practice too ;-;"
DeviousComet465,6,Please take note that u will not be able to clear any hours and weeks for summer internship as Y1 if you are in SCIS
Koufas,5,There are some students who do an internship in Y1 but they are in the minority. Its fine to not do an internship during Y1 summer and I would even say the norm
DeviousComet465,2,"Talk about your career path, your interest in relevant to the course you are about to apply for, your goals and why do you particularly choose SMU out of all universities and the learning outcomes that you are expecting. 

Do check the SMU Circle of Values to help you write more conveying SOP. Good luck for your application"
Arsenal_49_Spurs_0,18,"Don't worry about what others ask or laugh at. There's a reason why SMU is known for students who are empty vessels lol.

If the prof or your classmates say something interesting and you have something that adds value to what they shared, just bring it up. Or if you don't understand some of the content, seek clarification. High chance that someone else doesn't understand the same thing."
synrg18,7,"The people laughing have said silly things before as well. Don’t think too much about them!

End of the day, what matters is your grade. Contribute when you have something that comes to mind, and ask questions when you have genuine queries. It’ll help yourself and everyone in the end."
DeviousComet465,2,"To summarize your situation. Pick your poison

1) Stay in fear and comfort zone, don't speak up even though it may or may not be a good idea

2) Take a first step towards speaking up and learn to accept criticism in front of others

You need to make a decision, and I am sure you know the answer better than any of us do"
yonghongtn,1,"You can prepare before class by reading at the slides. The blanks in the pre-class slides are usually areas for class participation. Also, by preparing before class, you know what questions to ask"
Koufas,2,"Hello

I think its fine, just bear in mind that internship listings talking about penultimate students are likely looking to convert someone

Another consideration is to take into account when you are finishing school. If you have to do Y5S1, for bigger firms, HR would usually consider you as graduating one year later"
shiningmidsummer,4,"1. yes but you probably need to tell security you’re here for class
2. you just continue walking straight it will be on the left, pretty impossible to miss it as it’s on ground level"
MysticAuraa,6,lks if you don't have credits and gsrs if you do. other places are usually too crowded with too much human traffic or just aren't air conditioned imo.
yonghongtn,1,Want to consider SCIS B1 lounge?
kekekekekekkek,4,Not sure about that but SMUX mods have 50% A rate why u wanna s/u it hahah
Koufas,2,Yes you can - as long as it is not in your Cores
Prestigious_Nail_279,6,"Hello!  


I applied for mine early start of the year (Mar/Apr) if I'm not wrong, and got it pretty late end July. I recommend you emailing in to check on your application status, they got back to me pretty quickly just a few days later stating that some of my documents were incorrect, and they needed an updated one.

Email to: [finasst@smu.edu.sg](mailto:finasst@smu.edu.sg) (Centre for Student Financial Assistance)"
kekekekekekkek,3,"Hellooo there's nothing to worry about! It's normal for the review process to take many many months. Bursaries are on a disbursement basis meaning that they will transfer it into yr receiving account, so regardless you will always have to pay for the sch and miscellaneous fee from yr paying acc, it doesn't matter if yr application is still under review/approved/rejected!"
iridescent-stars,2,"i applied in end june and haven’t gotten mine yet too, i remember a previous email mentioning that we’ll get it by 31 aug"
tycoqueen,2,"Hello, I was in the same situation last year! Applied in May and only got awarded in late October (after sending them documents for review back and forth). I also emailed them about my status before and here was their reply: “Bursaries won’t be used to offset the tuition fee, and so, please proceed to pay the outstanding fee (don’t forget to pay for the annual miscellaneous fee as well).” Hence you don’t have to worry, cos in the end the bursary will still be auto-credited to your receiving account after the deduction of school fees period! Hope this helps :)"
endeavourzzz,2,Same here… applied in early this year… both loans and bursary under review
KovanLegend,1,"Hi!  I know this is a little late, but it seems you could do with some financial help.  Are you open to working part-time?  I might have something for you.

I have vacancies for part-time financial advisers (or as people like to refer to as insurance agent).  It is a little different as you will be guided by a mentor who is not your manager; there is a huge difference if you know the model, if you don't, I can explain to you.  This mentor is also open to doing your sales presentations for you.  

If you put in a reasonable amount of effort (I know, school is most important), I think you can comfortably earn $2,000 to $4,000 a month (there is a boost for the first two years, I will explain).

DM me if you are keen/open to exploring.  Cheers."
caekess,1,"idk if u still nd this now, but it has to be approved. the finance office did say that giro application usually takes 1-2 months to process"
Arsenal_49_Spurs_0,2,"Hahaha Charles is a nice dude.

The finals are absolutely killer. Don't be surprised when you can't finish the finals. Just do your best"
Arsenal_49_Spurs_0,5,Just plug into the sockets outside SRs or even use the SR sockets lmao
shinysqueegee,3,Following!
Koufas,10,"Ultimately, what decides your entrance into a bank-related internship is more of your skillsets (or your network, but there is little point in having a network if you dont have skills) than your CV/resume. They usually have structured and rigorous interview processes. At least when I interviewed for an internship, it was 80% technical questions and 20% personal questions. Very little about my CCAs

The pre-filtering process before your interview is also likely to be a games-based assessment rather than someone screening your resume or CV so prestige really matters much less than before unless you know someone personally la

If you join a finance CCA, you'd still have to work hard to keep your spot + learn the skills that the CCA wants to teach you. You could join more than one, but it is usually extremely difficult to keep up if you do both in the same sem because most of these CCAs have quite intensive training programmes

The network these CCAs offer you is very useful. Extremely useful. I'd recommend joining an acad CCA just because of the network + sharing of experiences alone. Really helps a lot compared to if you go into applications blind

Bear in mind that beyond the different banks, within a bank itself there are also different roles depending on what you are interested in. While most of the fin CCAs have networks that expand across various roles within the banking sector, it could also be helpful to think about which roles you are interested in the most

For a Y1, I think it would be most helpful to go into a fin CCA or a career dialogue to just learn more about banking and the different roles/skillsets required in the space rather than thinking about securing your career right now. I would also recommend you attend the Info sessions of the various fin CCAs or speak to seniors inside the CCAs to understand the commitment needed for each of them, as well as what they offer."
Koufas,4,"Quite realistic as long as you do proper mod planning

You can clear overseas experience without actually going overseas but opportunities to do this is limited especially moving forward after the COVID years"
Prestigious_Nail_279,-1,"iirc overseas experience is a must for all undergrads! but I’m not sure how things have changed this past two years (I’m still new, myself too)"
yonghongtn,2,"Generally both cover almost the same content. But 111 covers stock splits also. Since 111 is for accounting students, the exams should be also slightly more difficult."
Good-Ad-9136,1,You can check the course syllabus. Go to BOSS and click on the mod you are taking vs ACCT101.
Koufas,24,"Dont need buy coffee cans la or bottles la. Just buy coffee from one of the many stores nearby - much better than canned or bottled coffee and usually better value price-wise

For reference, here is a list of coffee places and their prices for kopi nearby SMU. Do support them if you can to keep them going

1. Huggs - $3.90
2. ~~Ya Kun - $3.50 for large now. Used to be $3.35 but increase alr. Small I think is now \~ $2.50~~
3. Koufu\* \~ $2.00
4. Onalu\* \~ $3.50
5. Starbucks at Lazada Building and at SMU B1
6. Behind Waterloo - $1.70
7. Food Dynasty - $2.40
8. Coffeebot (Hot Coffee) - $2.00 to $3.20 depending on which coffee you get
9. Korean Place near Bricklane\* \~ $2.50
10. Providence - $1.70+ depending on which coffee you get. Iced is slightly more. But they are usually not open so early in the morning
11. Toast Box closer to the printing shops - $2.50+?

\* I rarely buy coffee from these stores so I am not 100% sure if these are their prices/still their prices

Coffeebot only sells hot coffee. Available at SOB and SOL for a quick fix during a break or if you're running late

I personally buy kopi from Ya Kun, Food Dynasty, Providence and Huggs depending on what I feel like

Food Dynasty as its the most money-for-value while taking into account distance and taste and if I am feeling like a normal iced kopi.

Providence provides the best hot black coffee imo. Their wraps are also slept on for a quick bite. Essentially Happy Days cafe 2.0 so if I am feeling a muffin or a quick bite I will go there

Huggs is imo the best quality iced kopi around school but its a bit ex. Other Huggs chains sell iced kopi for $3.50 so I would usually not make this a regular buy. Their food is really good though

If you drink a lot of coffee, Ya Kun Large is the best one. I usually get this in the morning and it lasts me throughout the day. But I drink more coffee than most people la. I think most people if they buy Ya Kun Large they cannot finish though. The Ya Kun aunties also recently retired so big sad

Behind waterloo is the cheapest iced kopi near school but its a bit of a walk, will only get this if I'm eating there anyway

If you have lunch at Plaza Sing and want to buy iced kopi before class, B2 has a really good iced kopi place for $1.70. Forgot the store's name but they sell noodles and it is nearby the vegetarian wrap store which is closer to the MRT side

If Open Kitchen opens again at Connexion they sell iced kopi as well"
kekekekekekkek,30,Bro today is Saturday uni starts on Monday la scare me sia
sodiumstrawberry,5,"1. yep is okay
2. no need ask for permission, just go haha"
Background-Ad-4095,3,bro this one not primary sch
