Author Name,Score,Commment Body
rr_ayy,4,usually they only invite students with 3.5+ for interview so chances of getting in is really low. u shld apply for other schs as safety nets.
lostinliife,3,"Just apply, at most you lose $10 only iirc"
chillingbeer,1,"Last I heard, I have friends that got in Accountancy with 3.3! But currently I am year 3 going year 4 😅"
Careful_Economist154,2,"all smu administered scholarships must maintain 3.4. got some requirements. eg lkc scholarship must do double degree or double major, with one major not from BBM. merit must go for overseas comm service proj. not sure abt jc but just go for it, quite competitive tho there is quota for students from each sch for each scholarship"
Careful_Economist154,1,"i.e can’t be most merit scholars from business sch only, dun have law/acct students"
Every_Yellow_273,1,"SMU econs belongs to the school of science, so most of its modules are pretty math oriented. Having say that, the preassigned mods that you will be taking will provide you the foundation for other mods, so just proceed with an open mind. If you are still really worried, my best advice will be researching on the professor and modules that you wish to bid for (afterclass). For example, there's a professor that sets really hard papers for micro1 (whole class fail hard), but ensures that you go in strong for micro2, so you really got to pick your poison. The best tip perhaps is knowing yourself, how much you can cope, and when to drop a mod when you actually need to"
Koufas,3,">  
  
For PLE, what is the curriculum about? 

There is already a ton of information available online about the curriculum of PLE, including all of the classes you can take under the course. I can help you navigate it if you are unfamiliar with it, but do check it out on SMU's website.

In short, the way Uni works is that the school will give you a bunch of requirements to complete your degree. For reference, a class (or a module/mod) spans one semester (15 weeks). So lets say to complete a degree there are 5 general education classes you have to choose from a wide basket, 10 classes that the school deems fundamental to your degree, and then 10 classes of your choice that the school offers, that is under your field. The last group is called ""Major Electives"", or electives that fall under your chosen major. 

So lets say a student only studying one discipline/field will probably take something like (for example, this is not accurate, just an example)...

General Education: Management Communications, Spreadsheet Modelling, etc...

Compulsory for Major: Intro to Microeconomics, Intro to Macroeconomics, Math for Econs, Intermediate Econs, Econometrics, etc...

Major Electives: Advanced Macroeconomics, Globalisation, Economics of Trade, etc...

But, PLE is different because you need to take modules from 3 different fields, as well as interdisciplinary modules, as part of your compulsory classes for your major. These fields are Political Science, Law, and Economics. So instead, your classes can look like this:

General Education: Management Communications, Spreadsheet Modelling, etc...

Compulsory for Major: Intro to Microeconomics, Intro to Macroeconomics, Business Law, Governance through Law in Singapore, Political Theory, Politics of Southeast Asia, etc...

Major Electives: Advanced Macroeconomics, Health Law and Ethics, International Relations, Political Economy of East Asia, Econometrics

The specific number of classes, the names of the classes, and the exact breakdown of requirements for PLE (and of all degrees) are online. Let me know if you have any difficulties locating them.

There are a few implications of the syllabus of PLE students. Since you take a wider variety of classes...

First, your knowledge will be wider and you gain competencies over different fields. There are some who might say this takes away from depth, which is true to a certain extent, but I don't think that it affects vertical knowledge significantly to an extent it becomes a hindrance. I do feel that it is easier to pick up vertical knowledge on our own through internships, online courses, and self-initiated projects in SMU-X courses for example where we work with clients for projects. I think that it is much harder to train yourself to learn about a completely new industry or field if you have no formal education in it to do so. For example, learning law from scratch in a classroom is much easier (and importantly: accurate) than learning law from somewhere like Reddit. But if you want to deepen your knowledge about the law, you can look for judgements online or legal principles. 

Second, to maintain a higher GPA, you will need to do well in multiple fields. To do well in your law mods, you must understand legal principles sufficiently for example (heavily simplifying it here - law is a difficult degree). If you only take law modules, the skills and competencies build up overtime. However, in PLE, you need to do well in Econs, Law, and Pol Sci modules. You need different competencies, and you need to be able to switch between them quickly. Some might feel this is more difficult as you need to keep switching. That being said, GPA honestly is mattering less and less these days compared to what you are able to do

Third, due to pre-requisites of higher level classes, it takes slightly more planning to map out how you want to plan your classes. Cannot just take classes you want to - must really think about the requirements before committing to it. Makes going on exchange slightly more difficult too

I do think that if you really enjoy learning and applying yourself to different fields, PLE is very useful and engaging. 

&#x200B;

>Would there be a lot of math with the econs component? And if I am bad at math, will I struggle?

In PLE, there are 4 compulsory Econs mods you must take at a minimum. Econs and Society (JC econs), Math for Econs, Micro 1 and Macro 1. Other than these 4 econs mods, you can work your way through the rest of the PLE curriculum to avoid econs completely. On that note...

First, there are econs mods that are not heavy in math. For example, Economic Development in Asia is imo a good Y1 mod because the Prof teaches you how to read stats and research papers. Mostly about developmental economics in Asian economies

Second, I think there is this thinking that econs in uni = math. While it is true that there is a LOT of math, at the same time, it is not the exact same math we are used to at a JC level. To me, the way I see it is really about logic and using math to express relationships and how things work. Don't get me wrong there are still calculations, and a lot of them, but equally or more important is the logic we will learn is also about relationships between different factors. Exam questions can be as simple as they introduce a shock (ie x change to x-1) and ask how will that affect the rest of the model overtime. Not pure calculation alone, but using math as logic to investigate and prove something. But hey this is just my experience so far!

Honestly I don't think my shining point is my mathematical skills - in fact, calculations were one of my weaker points during my sec school and JC years that I needed to work hard on. But I am choosing to take more Econs mods in spite of it. Because I appreciate the value and importance of what I am learning, and am working hard to make sure I do alright. Including crunching the numbers. And if I can do it so can you!

Third, to answer your question, MFE is all about math, Macro 1 and Micro 1 both have a healthy mix of pure math and logic. More so for Macro than Micro imo. But you will still need to do calculations of course

&#x200B;

>What are the job prospects for PLE students?  


Too wide for me to list. Nowadays, it is not about the label printed on your degree. But rather, it is about what modules you have taken (which in PLE can be so many), what experiences you have been through (which varies from person to person) and what skills you have chosen to pick up in your own free time (which again varies).

There are seniors in consulting, research/analyst, public policy, banking and finance, social impact, marketing, start-ups, FnB... Really too many. Degrees are becoming less and less of a strong predictor of job prospects.

&#x200B;

>Same for PPS, what is the curriculum about?

For PPS, most of the information is widely available online already. In general, you will take some intro classes in each field (Intro to Pol and Policy Studies, Understanding Societies, Intro to Psych) and then declare your chosen major by the end of Y1. Then, same as other degrees - choose from the modules that the school offers

&#x200B;

>What are the job prospects for PPS students?

My answer will be the same as above: it really depends on those 3 things. Which can change even while you are in Uni. But probably more along the research and public policy route compared to PLE.

But I suggest getting a second opinion from someone in PPS. I have friends in PPS who would probably happy to speak with you about job prospects - am happy to ask around and link you up.

&#x200B;

>I heard that there is an interview for PLE, does the same applies for PPS? Any tips on how I can prepare for the interview?

In SMU there is an interview for all majors. In terms of tips. First, have a strong sense of who you are, your purpose, and your passions. This would allow you to show how you might be able to contribute to the school. Second, have a strong sense of why you want to choose this particular degree and school, and if possible, how you intend to use this knowledge. Third, read up on current affairs and about topics related to the interview you are going for.

Seems like you are going through quite a lot trying to decide your direction - which can be really daunting. Dropped you a PM through chat. All the best!"
Koufas,1,"I will answer this when I get home tonight or tomorrow morning. PLE student here. Parking this for now so I dont forget

Edit: If you scroll into my comment history you can probably find me writing long answers about PLE"
AdhesivenessOutside,1,What if I’m a prospective Uni student but is interested in this :P
Soon-to-be-forgotten,2,"Usually, CSP hours are a selling point for committee recruitments. 

So, if it isn't stated anywhere, just assume it doesn't. But you can try asking the organising committee if you are still unsure."
Koufas,3,"Yes

In the PPS programme, in Y1 you will have to take an Intro mod to Psych, Intro to Public Pol Studies, and Understanding Societies. This is to give some basic exposure

But after declaring your major at the end of Y1 you will specialise in only Psych, only Pol Sci, or only Socio

Feel free to AMA

Edit: Just looked through your post history. I am from sosci and can probably answer most of your questions, but if you want, I can try to find some friends doing either a double degree in psych/biz or at the very least a psych first degree and second major in a biz major

If you have industry-related qns can try to link you up too

Let me know"
ImpressPhysical4743,1,"yes you can! under pps, you can choose to major in psych in your second year."
Spencz7,1,!NotifyMe
Koufas,1,"Iirc you need to write an essay on why 

No tuition changes although if you take more than 8 sems dont forget the gov tuition grant no longer applies and you will be paying non subsidised school fees as the government is no longering subsidising you (ie 45K compared to 11K a year)

I know people who transferred to SOB in Y2. Can link you up with them"
Sensitive_Ad_9307,2,"Hi OP, was a local IB student as well. Can’t provide you with a grade range but with a 43, you won’t have any issues. In fact, you can probably even apply for a double degree (CS + something else) without any difficulty and might even have chance for scholarships. (I’m not saying you must or should, just letting you know that you can haha). But congrats on doing well for IB :)"
Sensitive_Ad_9307,6,"1. Yes, your free elective will be used to clear your CU requirements for your second major
2. If you choose Econs, you will be graduating with a bachelor of science (economics). If you choose Finance, finance is a business major so you will be graduating with a bachelor of business management. The uni core mods will be almost identical (Econs has a specific numeracy mod that other faculty students don't have to take) and you are right to say that the main difference is that for Finance (you will be taking 11 biz core CUs + 6 Finance majors CU) and for Econs (9-10 Econs core + 5-6 Econs Elective) For the second majors, most of the time the req is around 8 additional CU which essentially takes up the free electives
3. From what I understand, Econs in SMU is very math heavy so you should take that into consideration."
monke_booty,1,"Hi recent graduate here, I can try to answer some of your questions:

1) For lectures, it is more intimate in the sense that the rooms are smaller which allows you the opportunity to be noticed by the professor more. However, how personal you want to be with the professor is entirely up to how you want to interact with the prof. Some of the classes and profs are engaging enough to warrant interactions, but some are not, so that factor affects it as well.

2) I am not from accounting, but I am pretty sure that every school undergoes similar interview processes. In my opinion, of course, academic ability is a factor of success in the interviews, however, the key ability is to articulate the points in a group interview confidently (which is designed to model our class style). So, just articulate your points confidently and stick to your opinions.

3) I cant help there, my friend."
mngomllk,3,"hello!! i’m a ddp student at smu the minimum rp is 85rp i think!! ik someone who got missed the cut by a little bit (84) and appealed but cldnt get it so theyre p strict on this for ddp i think they strictly see ur rp so idt aba will help in this case? 

nevertheless if ur gpa meets the cut in y1/y2  you’ll be eligible to apply for ddp too

imo biz and accountancy is one of the most worth ddp there are a lot of overlapping mods (u can read the handbook) so out of all the ddp programs that smu offers it has the least amount of mods to clear so u can definitely clear in 4 years if u overload abit (ie take 5 mods per sem instead of the usual 4 mods)"
edud_neb,1,"Sounds like you don’t know what you want. Cause both degrees are mutually exclusive when getting a job. 

Your first job would like be accounting. And when you want to switch jobs, you’ll prob go get an MBA which makes doing the degree now moot. 

Spend your time wisely."
anxiousprogrammer96,2,"Hi, I took in 19/20 term 2 when COVID just started. My midterm test was switched to a take home Midterm essay. Quite easy to score, she just ask a list of questions and you have to answer by referencing to the notes e.g. Servant Leadership or self organising team. If cannot find can just Google :) Don't know about midterm test tho"
sendmeme2me,1,"hi, i took it last term and it was just a open book case study. There will be guiding questions for you to answer and you just have to apply relevant leadership theories."
baconpancake002,1,I don think so bt no harm in trying so just try... cn take tuition grant
anxiousprogrammer96,2,"I am in Y3T2 currently taking COR2201 it under prof Pang Eng Fong. It is a rather chill/relax mod, he shares alot about how humans have used technologies to get to where we are now. He will also show videos of current technology e.g. Tesla, sustainable energy and more. The group presentation was a breeze, just have to share on a topic relating to that week e.g. Media and get the class to class part. The final exam is open book :)"
Soon-to-be-forgotten,1,"Frankly speaking, it's quite unlikely someone can answer your questions with confidence, since most students would only take one of these modules to fulfil their technology basket.

From what I understand, each of these modules is only taught by one professor. Hence, there's not much you can choose from."
Gohbraztsovashka,1,"Depends on where you’re coming from. If you’re severely mentally ill or have a thousand commitments it can be easy to fail even if you make every effort to do well

But if you’re living a balanced life and trying hard then it takes effort to fail"
pharqeeter,2,I’m interested in the CS notes too! I’m matriculating this year
agavege_,6,"Afaik, learning commons of KGC (i'm guessing the 3rd level) and LKS (2nd level) are 24/7. Besides that I'm not sure. Thought study lounges were 24/7 also but apparently they aren't, maybe only during finals period."
Koufas,1,"*Note: the other person who commented on this is shadowbanned*

Hello there :)

After \~20 years of living, it is likely you are at least slightly aware of...

\- What your interests are (professionally and personally. Do you gravitate towards a certain role, software or style when doing a group project? What do you like to do in your free time?)  
\- What your competencies are (mathematics? solving problems in a certain field? maybe you are good with people?)  
\- What your values are (passion? Earning $$? Purpose? Like helping children, maybe you are religious, or maybe you enjoy making insights)  
\- What your goals are (marry in mid-20s? Need earn more. Ok with waiting a bit? Its ok, can progress later)

I'd suggest writing a list to help you decide and commit to what you want to define as important to you

After you decide on these things, you can start to narrow down your job search already to the kind of roles and industries. For example if you value work-life balance, certain fields are less likely to offer this. If you value passion/purpose, you need to find something you believe in or align with.

If you do not have a preference, or if you genuinely do not know, I'd suggest asking your close friends for suggestions as they usually have an inkling of what you might be good at doing or like to do.  If you are still unconvinced and undecided, I'd suggest trying to take on more experiences with whatever time you have (ie part-time job, part-time internship, volunteer with certain sectors, initiate more self-started projects) to try and get some experience. Need to try enough things to have a better understanding of who you are or who you want to be. This usually involves more experiences, such as speaking with people already in these roles, or doing more internships/projects. The bottom line is that we only know more about ourselves through these experiences, and if we don't try to put ourselves through them, we will never know. Gotta put ourselves out there and try

If you do not like the experience, that is ok - at least you tried and have a better understanding of what you like, don't like, can or cannot do, etc. And it is only 3-4 months

It is perfectly fine to LOA to take a few internships in a row to find out what you like even at the cost of delayed graduation. I know someone in SMU who is in Y3, will be graduating a year later than most people, but is currently on his 5th internship. The intern pay is sufficient for him, but he does not save much. A very good trade-off imo since he wants to plan his career very carefully.

If you need personalised help, you (and I guess anyone reading this) can feel free to PM me on Reddit. I (and a few friends) regularly informally help juniors/mentees to narrow down their future major and career choices. If you want to find out more about a certain industry, you can PM me too and I can see who would be willing to speak to you about it"
Soon-to-be-forgotten,3,"Nice website!

Originally that the mobile website was faulty, then I realised that SMU doesn't like to provide median incomes for some weird reasons."
Soon-to-be-forgotten,3,"I'm not in a business major but my advice is always to apply for all the courses you can apply, provided that you want to enter the course.

It gives you more choices, just in cause a school rejects you.

Consider to post in r/sgexams to learn more about other universities."
Koufas,1,"Hello

You should definitely apply to all 3 if you want more options and are not sure at this point of time. Only limit yourself if you are sure you do not want something

In SMU, Comms Management itself is a major - you can choose to take that as your first or second major. If you are really interested in it, SMU also offers a MSc in Communication Management for you to consider

Double major/degree is only worth if you are really interested in what they have to offer. It takes a lot of work to maintain a double degree, and you would likely have to overload yourself a sem or two, or spend a summer clearing a course or two

I think it really depends on your end-goals. If you feel like hall life is important, then NUS and NTU is definitely for you

But if you enjoy a seminar-style pedagogy where your classmates are participative in class, then SMU is the clear choice

Can't say too much about the other schools, but what I can say is that SMU probably has the most vibrant student life out of the three choices. COVID-19 means that instead of this vibrancy being on show, you have to show up in different pockets where different groups can have their own sessions while staying in line with regulations

CCAs are extremely vibrant, and if you are looking for extra-curriculars to jumpstart your career or to just have fun with like-minded people I can say that there are many events, groups and CCAs that have these people in them. Also career-wise, some CCA EXCOs intentionally organise things/sessions to guide students further towards further career choices

I'd suggest going for the Open House to find out more. PMs are open for questions on SMU"
Esphyr,2,"Hi! Not a Senior but I’m currently in the EXCO for 2 different CCAs (1 Student Govt Body and 1 Club). 

Based on some of the interviews I went through and personal observations: 

1. Prepare some responses to common interview questions. The usual generic questions (tell me about yourself, what makes you suited for the role, what are your strengths and weaknesses) ALWAYS come up, usually as the first 2-3 questions. Make sure you tailor your responses to suit the role you’re applying for (e.g, if you’re applying for Honorary General Secretary and when asked about your strengths and weaknesses, DO NOT mention that you can be unorganised at times - even if you consider it to be a weakness of yours). 

2. Study for the role you’re aiming for. It’s quite common for the EXCO to ask scenario based questions in interviews related to your role. Knowing what you’re interviewing for is important - if you can’t answer a question related to the role you’re applying for, why should they give it to you?

3. Befriend the current EXCO. No, really, I know of a few people who had it slightly easier to get into EXCO positions (including one EXCO I’m currently in) because they are friends with the previous EXCO (aka the people that choose who to recruit). However, these few also did have the skills to back it up - their friendship just made the decision process easier.

Based on a conversation with my Y4 friend, the “prime time” for EXCO would be in Y1 and Y2 since that’s when studies are still somewhat “chill” compared to the later years. But don’t limit yourself to these 2 years; I know of a few people who joined in Y3 too. 

I can’t really advice on joining EXCOs in Y3 and Y4 but would say if you have the time, it could be fun :) we only have 4 years of uni so might aswell enjoy ourselves."
iridium19204,3,Sounds like you have a decent chance! Remember to check the English requirements for international students too. All the best!
lostinliife,1,"The answer is, we don’t know. Shoot your shot, and try your best :) Good luck!"
jchewst22,6,Yes. Go for the interview. Ace it! The all A sometimes don't Make it thru the interview. Share why you like SMU to apply for it. All the best
Koufas,2,"Apply. If theres a uni in SG that looks at you holistically instead of just at GPA its definitely SMU

PM me for advice on resume/personal statement and I will do my best to help you succeed"
isleftisright,1,Won't know till u try.
Eurito1,1,Can take a look at [SUSS PT Degree programmes](https://www.suss.edu.sg/part-time-undergraduate/view-all-part-time-programmes).
Glad-Accountant-6476,1,"Based on my experience, there isn't any required test to take! Just interview :) ATB!"
chillingbeer,1,"no QET unless you did badly for o levels, well im a c6 for english but no QET for me HAHA"
sassypandazxc,1,yes please.. i only left about 30 hours to clear.
lostinliife,1,"There’ll be another one later on (1-2 months before Uni), but certain clinics can get crowded. 

Also, this just confirms your spot."
Serarion,2,Have you tried contacting the student service hub through email? They were the one handling the concession card collection when I collected mine back in September. Hope this helps!
Own-Most2752,1,Where do you want to go?
Koufas,2,"Depends

Most of the time, after the school semester ends, if the Prof needs a new TA, they will e-mail a few candidates about it. Those who scored A- and above, or maybe students they have noted down during the class as potential TAs. A- is the standard requirement they will look at first, though. Likely has something to do with SOP but not 100% sure

If the Prof is unable to find a suitable candidate, it will be opened up to the rest of the class or the whole school through e-mail

All candidates will go through an interview process. After selection you will go for a short IT course on how to navigate/use/manage e-learn from the perspective of someone who has the rights to adjust things on it"
