Author Name,Score,Commment Body
Soon-to-be-forgotten,4,"Omg. Are you a new mod? I tried to request for the subreddit *twice* and they didn't pass my requests haha.

I'm glad at least this subreddit is revived."
Schnoobs69,2,Awesome to hear this! I’m a prospective exchange student and I was bummed out when I couldn’t ask any questions here
TerreeHermes,2,Nice!
Eurito1,1,There were a few [reddit requests](https://www.reddit.com/r/redditrequest/search?q=smu&restrict_sr=on&include_over_18=off&sort=new&t=all) recently to mod this subreddit. Perhaps you can reach out to them?
isleftisright,1,Happy to help mod too. I was sad to see how quiet this sub reddit was
Koufas,1,Can we change our flairs manually? Mines incorrect
kekekekekekkek,1,I've tried to post here a couple times but was rejected.. Halp?
One-Tail-5082,1,"hiii, y3 acct student here!

1)Generally, modules based in accountancy is like 1.5h lesson, 0.5 breaks, 1h+ lesson to the end. Most of them are lecture base, with allocated time to do some class practices. Honestly contents for acct are pretty heavy and you have to either do some work before/after class in order to absorb every content well. For other modules, it varies. Some have weekly presentations by each group, or interaction activities (feels like I'm in primary school sometimes but its literally where the fun is), etcetc. But regardless which modules, all the professors (and teaching assistants) are willing to help if you consult them after class, or drop them an email, or even set a time to meet after class. Generally the teaching style here is just: contents-examples-class practice  


2)Accounting mods generally don't emphasise much on class part. Lets say for non-accounting modules, there may be 15-20% of grades allocated to just participating, some even more nonsense ones will evaluate based on the number of times you open your mouth (e.g. raise your hands n speak 3 times a lesson to get an A). For those mods, you can try your best to just speak up, sometimes to clarify concepts, sometimes to share something simple (e.g.: answering questions on: what is resilience? and then I will just google and read it out even though everyone can do it too).

As for accounting mods, many times the class participation grade is 10%, but sometimes just attending class would already be like a passing grade. Profs there generally aren't too hard on you to speak up in class, although many appreciate your responses so that they can move on in class (i swear the classes always get delayed or stuck cuz no one volunteers to share things). Even if you say something wrong, at least you will get corrected. Generally not much pressure to speak up compared to those non-acct mods.

3) For culture, I'm not too sure since I'm the covid batch and don't have much interactions. But even if I'm not from the covid batch, I will still do the same (9/10 times i go home after school) since I am probably drained out from the interactions + 3 or 6 hours lectures (if there's 2 modules).

But I observe many people having the time of their lives whilst in SMU, making friends (or acquaintances) here and there from group projects, CCAs, etc. So I believe the culture doesn't matter as long as you be yourself and have fun (within your own definition)? HAHA hope i helped, all the best!"
glehkol,8,"> plus i did better than expected for my A levels so it seems a bit wasted

just adding on to what the others said, but don’t chase hype just bc of good results ah"
sanguineuphoria,3,"Think about what you want to do and apply for that course. The worst thing would be to come out of the 4 years of uni and realise that you hate the job and can't stick it out any longer, but you don't have the skills / paper qualifications to do another job that you would prefer. I am in law and there are people around me who never wanted to do law in the first place but applied because of parental pressure / just applied what they could get with their score are regretting it months into practice.

If you don't know what you want to do, you could take this time to try applying for some internships and see how the day to day work is like.

Do also note that being a legal advisor to tech companies (in house counsel) usually entails working in private practice for several years to hone your skills and build up knowledge before you are able to hold your own and provide advice."
fuckyoudanke,2,"imo you should decide on your desired career path. if you wanna go into law, go for smu law. if you wanna go into tech, go for IS. if you are interested in business roles like strategy, marketing or finance, go for business. workload wise nothing is easy since this is uni, unless you are one of those geniuses."
shadowz0,2,"For law, you better have good time management as the readings are massive for law mods, if you decide to pair with IS/CS, good luck :) most likely you won't have enough time in the day to excel in both unless u have photographic memory or don't sleep. Coding wise, scis will teach you from scratch but you have to put in the time to learn and master coding.  


Smu's is most popular with finance with pathways into IB and high finance with econ and double major finance(math heavy). but the other degrees are also viable."
fireflight13x,1,"Use your NLB Udemy account (Google how to log in) and go try a course on Python on Udemy. This gives you free access to some coding courses that are pretty decent.

Since you've never tried coding before, this will give you some good exposure to the very basics of the most widely used coding language. Try it for 2-4 hours or so and see how you feel about it. It's far from sufficient by any measure, but if your instinctive reaction to it is a disliking, that's quite a clear no to anything CS. If, however, you feel excited and enjoy the logic behind putting the code together, it might be possible to explore more. Don't worry if you feel some confusion, the main question is whether it excites you.

This is by no means a clear indicator of how well you'll do, but it's at least a litmus test to tell you how you might feel towards coding and whether you dislike it or not. That's a vital part of any CS course. If you do end up taking Law+CS, you can then continue the courses before your uni starts also so that you have some prep."
1800-doodoo,-5,nus law degree can also become in house counsel for tech company why not consider that
dataauntiee,1,Probably after the exam? The exams are done by 31st march for PG .
Hondrus,1,"Last year when I TA-ed during sem 2, SMU giro the salary to me on 30 May. I assume that they make payments around end of May."
Soon-to-be-forgotten,1,"I'm admitted a few years ago. But I applied in late February, was interviewed in mid-April and got my offer late April. So, 1.5 months and 2 months respectively.

So, it seems that you are not necessarily rejected yet.

You can try to email them and ask about the progress if you're worried. But I think they will just give you a standard answer that they are still processing."
DrowzyHippo,1,waitlisted in may and i only got my offer in june 💀
Koufas,2,No but you can ask on ask.smu or the exchange tele chat
CheezyGraduate,3,"Take SMU IS imo 

I think the starting salary for SMU IS is higher but feel free to look it up yourself"
One-Tail-5082,1,"Imo, given the trimester structure in SIT (possibly no selection of timetable) compare to SMU with much more flexibility, I think SMU would be a better choice since I believe to land a role, you probably need to go for internships, case competitions, etc etc?? And in SMU you really can plan your life out (if you are very driven) I'm not sure since I'm not in this field but just my 2 cents (:"
infernoKings,1,"It really depends if you want to be stronger in technical skills, or more of soft skills (communicating with stakeholders, product management, etc). 

I have multiple interns coming from nus, ntu, sit, smu, and the SIT interns tend to be better technically due to the rigorous course they’re put through, that is of course, if you really grind it out and manage to pick up the concepts fast. The SMU interns on the other hand, are better in theory as compared to practical, probably due to way the course is structured."
amey_wemy,0,"SMU IS is more towards product management from what I've heard and seen. And most cases of ""does not limit your options"" tend to be towards software engineering. I'd imagine it to be significantly harder to land roles in data science (requires stats/math) or cyber security

But then again, I could be wrong bah"
sflec16,1,hm maybe you can email the office? but yeah I'm taking DM this sem too and my grades are really q bad so I'm worried also. it's the first sem that my grades aren't that good so it's a bit worrying but jiayous! lmk if you find out
clappingcopper,1,"Anyone feel that Q3a test cases are bugged? 
I passed all the test cases but later found out every returned array was wrong after the test. I didn’t realize there was a helper function to visually check my array…"
Expert-Leg-5226,2,"hi! it depends on profs and the mods tbh, i have a mixture of both online and hardcopy submissions across my mods :)"
One-Tail-5082,1,"just to add on, the school might be looking at doing it digitally next time (yay for some, nay for many)"
endeavourzzz,0,"From last semester, our finals were done online lockdown browser for non-Accountancy students (ACCT101) and on paper for accountancy students who took ACCT111."
aclevert,1,"Computer science is a more theoretical discipline learning about how a computer works such as computing algorithms, memory and its software/hardware design+implementation. The swe programme is a more practical work study programme mainly teaching you how to program software such as developing web applications."
DeviousComet465,1,"SWE has a smaller cohort coz it is a relatively new course. Mainly SWE is trying to train u to be web and mobile app developers

Comp Sci will have more technical depth and more math intensive but it will not have much abt software development since its main bulk is on the back end side of things such as writing efficient code and creating algorithms to solve complex mathematical problems"
Koufas,2,"86 is possible. Its hard to say what a ""high"" chance is - it could also be that someone with 90 RP is generally a better candidate than someone with 86 RP

Either way, 86 is definitely possible for some of the SMU scholarships

Have you considered a loan as well btw?"
IllFan1730,1,"Install MaNaDr and request for online consult with/without medicine. When you are connected with a doctor and accept the video call, explain your symptoms and they'll usually give you 1-3 days MC. The call usually lasts lesser than 1 min. Then you'll receive the MC via email and in the app itself."
Zestyclose-Title6822,1,Yea I got interview date during recess week
babybirded,1,"go carousell, search ur course and some ppl will sell notes. that is more relevant"
Koufas,1,"You can google for the SOE Student Handbook for an overview

Honestly i dont think theres much point trying to prepare that much or that intensively on your own when in the future, Profs + school will help you prep 10x more efficiently than now

My suggestion would be to a) read Econs papers to get a better idea of what your future field is like; b) learn excel, stata, eviews or R because those things are applicable for Econs directly, c) watch YT videos like Khan Academy on some basic concepts if you really want to and d) learn more about possible career options

I can help recommend some of the more friendly econs papers i have come across before if you like and am happy to chat about career options too"
MysticAuraa,6,"Current y3 IS student. The variation is very high depending on who you ask, I have friends who spend at most 30hours a week and some who spend more than 100. Personally, I'm one of those who spends about 100 as I'm taking 4 mods + 2 TA mods and CCA exco"
DeviousComet465,5,"Currently I am a freshman with 4 mods and 4 CCAs, roughly 65 hrs on school work for me"
dataauntiee,2,"I am a masters student (MITB) 

-I think I spend atleast 30-40 a week on just university stuff ( not considering internship) ,Projects eat away most of my time ! 
I took 4 mods and it's pretty hectic (terms are pretty short 12 weeks in total per term - 10 weeks classes -1 week break - last week will be exam)."
Pretend-Indication-9,1,"The average I find is 8 hours a day, 7 days a week."
Good-Ad-9136,3,"1. I haven't seen any from my experience, but there could be

2. Depends on your results and portfolio - might want to think why u want the MBA

3. Not sure how to answer your question - what about it?"
Koufas,3,">How is the business culture like in SMU? are the rumours true there are alot of snakes in the course 💀💀  


Not really... Its an old stereotype. Not more than other schools imo

>how hard is it to be accepted into in a good mba school after graduation seeing how SMU is less internationally recognised as the likes of NUS

For MBA, its much more important to have a good story and reason for doing an MBA, as well as a relevant job that contributes to your story. Where your degree is from matters much less than these two things

Its not like NUS is that much more internationally recognised anyway for MBA. Plenty of SMU students go overseas for further studies after graduating

>how is the core curriculum like for finance?

You can google ""SMU SOB Student Handbook"" and look through the Finance second major for more information"
Legendary_Golden_Bud,2,"1) To me mostly quite chill, snakes haven't really encountered them but I've encountered lazy people that don't do jack for projects. 

2) No idea

3) cant help u there, not planning to take finance"
IcyIcyTower,3,I heard of people getting in with 3.5 but not sure about lower than that.
Medium-Top-3500,2,"Yes theres definitely a chance. One of my classmates did quite bad especially during his internship but he still got in to SMU. However, one of my friends told me that it was actually kinda by luck because of someone that SMU reserved a spot for rejected SMU, he then got a spot. 

And also my other friend had like around your GPA and she got in through interview. 

So you still do have hope but do try and pull up your GPA if you can. Oh and all these students are from accountancy :))"
Sad-Yoghurt2395,2,"my friend with low 3.5x for 5 sem cgpa and a pretty stacked portfolio (icaew certs, big 4 internship, participation in competitions) managed to get an interview and was waitlisted but in the end didn't get in :( i would say there's definitely still a chance to get interviewed if you have a decent portfolio! im from SOA too so if u can pm me if u have any qns!"
babybirded,-3,see la never work hard then now cry here. Still got SIT and SUSS what... or u take acca or isca lor.. Also can get to the end point. Dun cry over spilt milk. Work harder for ur final exam and try ur luck. Tbh i hope that SG will have lesser local uni. Else the top 3 cgpa keep falling until so many kind of people joins in. I personally work with so many trashies. sorry to say that. u better up ur game even u are in smu.
Plastic_Berp,1,Thank you! That really encourages me
DeviousComet465,1,"Have to depends on what courses you wanted to take, u can refer to each uni's IGP to know roughly where u stand"
Own-Calendar1384,5,"get the M2. 
most people use apple. there's no specific OS requirement and every class usually has instructions for both Windows and Mac if any software is required. And if you already have a windows PC at home then you always have something to rely on if you ever need windows. I personally use an M2 Air (for CS) and it has been great. The only issue i faced was my c compiler dying because of the new update (can still manually compile) but since you're in IS that shouldn't be an issue."
lebruce99,2,"Year 2 IS here. Both Mac and Windows are fine and the modules will have troubleshoot for  both OS. There are a lot of Mac users here and I assume most of them are using Apple sillicone. However, for certain web development needs, M1 or M2 chip support is quite new and you would have to figure out how to get it to work.

It won't affect your mods but just when you play with other frameworks or packages outside of your curriculum for your personal projects or etc, you may need to Google for a fix. Get the Mac of you really want it, the interface and screen is so much better than most Windows laptop."
Jjzeng,2,"Save your money, get a windows laptop. Lenovo’s online store has 5% student discounts. Any OS issues can easily be addressed with a virtual machine if needed"
shitama,3,"It’s based on your final results. Though I would say that May students are less likely to get a scholarship because the timeframe between getting your actual results (July 6) and uni starting (August 15) is so near. Most of the time, the scholarship slots would have already been allocated."
Koufas,1,"The chance of this is likely to be really low

[https://admissions.smu.edu.sg/admissions-requirements/indicative-grade-profile](https://admissions.smu.edu.sg/admissions-requirements/indicative-grade-profile) 

That being said if you have a good portfolio you might still have a chance"
Alive-Arrival9918,2,Y2 here. What do you wanna know?
MysticAuraa,2,Y3 here. Can dm me for any questions
Steelhound,1,"There are multiple factors, your GPA, your year of study and your resume. Feel free to pm me for more information."
Koufas,6,"There is no GPA requirement for exchange strictly speaking, but since the popular schools for exchange have limited slots they will prioritise students for a specific school by GPA. So if you think your GPA is not competitive might be better to apply for less popular schools

My opinion is that GPA isnt everything. It is impossible to compete against perfect 4.0s, so we have to compete on fit. Thats a lot easier said than done, though

If you feel like your GPA is not competitive enough, you should try and do more internships for more experience which will give you an edge. For my next internship for Summer at a bank, even though my GPA is not the highest and I dont have prior banking internships they still took me because, according to them, I will need the least training due to my past relevant experiences. Nothing to do with GPA. The person who hired me explicitly said that GPA is not the most relevant metric

If your GPA is too low you might be filtered out by HR of some of the larger firms, but imo, skills are much more important than GPA. You just have to have an outlet to show these skills - be it more internships, your own sideprojects, CCAs, etc

Most of the bigger firms are also transitioning to GBA for first round of interview rather than screening based on GPA/CV anyway so...

GPA does matter - but it matters much less than everyone thinks it does"
Time_Reaction467,2,Well if you wanna do any of the program that offer by smu I am pretty sure you need to have a good gpa
DeviousComet465,2,"Scholarships demands high GPA, you can't escape from that. Min cost to stay here is abt 1.5k SGD including rent imo. Might have some one time costs u nid to check properly too"
galaxystanddd,1,"Ok for a scholarship,they accept more aptitude based admissions these days,so do make sure to build up a strong portfolio.Try to include leadership positions you had in secondary,post secondary schools.And also include the CcAs you took part in."
FlameGreyWolf,1,"Are you considering to transfer or to complete something like a Master's here? 

Keep track of the window for application: which is currently now - early March. 

Gather all your things together that could make you have the aptitude for the course: portfolios and history of projects/work or things you have been learning or dabbling in. 

All the best for the application!"
DeviousComet465,3,Idts thr are any CSP that clears oni 16 hrs. Some short ones you can consider are like FO
stooopidboy,3,7 sessions (2.5hrs each) of food packing at food from the heart. you'll need to self propose on ontrac
diamond_apache,4,"Hi, im also Y3 in SMU specializing in AI. I'm interested but just curious regarding the possible copyright, licenses issues. If im not wrong, chatgpt isnt open source. So i'm not sure will there be any legal issues incorporating it into an app. (If the app is for commercial uses, im pretty sure theres gonna b some legal issues?)"
itsziul,1,Hi! I'm a M.Sc Computing graduate from SMU and I would like to know more about this project! :D Will send you a message here
joinlimlim,1,"Not in SMU, but great to see the interest in building on top of Open ai’s api. Happy to help ideate around use cases or creating long term memory for your chat bot"
DeviousComet465,1,Send the github link here XD
Koufas,2,Which Prof are you under? If youre under Prof Sunha Myong feel free to drop me a PM
shadowz0,2,"the smu annual career fair ah, remember bring the name card that you can get from student service hub. And just go with an open mind, with a few questions to show that you're interested in the firm and the position"
DeviousComet465,1,Don't be nervous
MysticAuraa,3,"I'm from IS and from my personal observation, most people in that range tend to intern in startups, mid sized tech consulting firms, but also maybe local banks such as DBS / OCBC, grab, shoppee, etc. It honestly really varies alot and most of the time, you just take what you can get."
Koufas,1,"Which year are you in and what do you think you are interested in?

Am not an IS major but there are so many different types of roles nowadays its pretty hard to characterise everything solely based on major and GPA tbh"
Koufas,2,"Iirc at the start of COVID they were taken away to make room for students who were living in Prinsep since a few blocks were used as a quarantine facility

I think they just did not place the beds back. When SMU Labs were still around before Connexion, it was FCFS. No booking required

If you want to sleep there are some places though. Fishtank has sofas you can lie down on. SCIS Lounge is probably the best place - it has a corner which is dark + has beanbags + some sofas"
dataauntiee,2,"Try looking for places far away from uni, you might find a decent one fir around $1200"
Koufas,2,"Yes of course. If theres no stated requirement its not an issue or a concern

Although I will say that nowadays, having the highest GPA does in no way guarantee anything. Holistic development is super important. Employers know there is much more to life than GPA. A good one helps, but if you arent as competitive in other areas, someone else with a GPA of say 3.7 can be more valued"
Soon-to-be-forgotten,1,"After the tuition grant, you can borrow up to 90% of the tuition fee amount paid by Singapore Citizens who admit in that particular academic year.

But not too sure if this is directly applicable to international students.

Look up pages on [Tuition Fee Grant](https://admissions.smu.edu.sg/financial-matters/tuition-fees-grant) and [Tuition Fee Loan](https://admissions.smu.edu.sg/financial-matters/financial-aid/tuition-fee-loan) to understand more."
Accomplished-Disk398,1,"Check OCBC, Maybank and DBS, etc. tuition loans. Citizenship is a factor in student/tuition loans"
DeviousComet465,1,About 25K per year
chickenwingandbbq,1,"I’m taking accountancy degree, it totals up to about $34k overall but the MOE tuition grant deducts about $9k. (Annual fees for international student) You can pm me for more info :)"
Koufas,7,"An invitation for early admissions is just an invitation for you to submit your application early in the first round

Discovery Day means that your application is strong enough to bypass the interview portion of the application

Inviting you to apply early does in no way guarantee Discovery Day 

Either way just sit tight they rarely do everything on the same day; just have to wait for a few days or even weeks to see how things pan out"
Suspicious-Source-48,2,HI!! i’m also in the same situation as u rn :/ i haven’t rcved anything yet also but i used the smu live chat apparently there r more than 1 discovery day.
DeviousComet465,1,"Very unlikely to get in thru early admissions wif 3.7+. I applied CS wif 3.8+ also didn't make it, so try and apply during the actual admission range of date"
mautalpol,3,"I heard it is for admission offer, so in short, you attend the event on the stated date and after that, they will send u an offer."
Time_Reaction467,2,"I don’t believe anyone knows will even tell you , but I am guessing should be 3.75-3.8 is the minimum to earn a sport for early admission discovery day"
Koufas,2,"It is not a GPA thing - it also takes into account other parts of your application. Although, usually, very high GPA/RP applicants would automatically receive it

That being said my senior had less than 75 RP and still got discovery day"
mautalpol,2,"Hi, I am also an international student, applied in early Jan. Received discovery day for Information Systems today."
VurhD-2312,2,If you get early admission then around now.. if normal admission then around may to June max
Koufas,2,"Now is the discovery day period - which not everyone is eligible for

Intl students are not considered during first window admissions, much less early admissions

Just sit tight - it is usually quite late"
